<?xml version="1.0" encoding="utf-8"?>
<xs:schema attributeFormDefault="unqualified" elementFormDefault="qualified" xmlns:xs="http://www.w3.org/2001/XMLSchema">
   
  <xs:element name="albara" type="tipusAlbara" />

  <xs:complexType name="tipusAlbara" >
    <xs:sequence>
      <xs:element name="codiComanda" type="xs:integer"/>
      <xs:element name="data" type="xs:date"/>
      <xs:element name="articles" type="tipusArticles" minOccurs="1" maxOccurs="unbounded"/>
    </xs:sequence>
  </xs:complexType>

  <xs:complexType name="tipusArticles">
    <xs:sequence>
      <xs:element name="article" type="tipusArticle" maxOccurs="unbounded"/>
    </xs:sequence>
  </xs:complexType>

  <xs:complexType name="tipusArticle">
    <xs:sequence>
      <xs:element name="codi" type="tipusCodi"/>
      <xs:element name="quant" type="xs:integer"/>
      <xs:element name="preu" type="xs:integer"/>
    </xs:sequence>
  </xs:complexType>

  <xs:simpleType name="tipusCodi">
    <xs:restriction base="xs:string">
      <xs:minLength value="1"/>
      <xs:maxLength value="4"/>
    </xs:restriction>
  </xs:simpleType>
  
</xs:schema>